{
    "$schema": "https://example.org/ka.schema.v2.json",
    "$id": "https://example.org/cs2023/se_sample_v2.json",
  
    "schema": {
      "name": "ka.schema.v2",
      "version": "2.0.0",
      "generated_at": "2025-09-15T00:00:00Z",
      "source": { "name": "CS2023", "edition": "Gamma" }
    },
  
    "knowledge_area": {
      "name": "Software Engineering",
      "code": "SE"
    },
  
    "description": "Software engineering emphasizes teamwork and long-term evolution (multi-version) of systems—beyond individual programming skill—covering design, construction, testing, maintenance, and professional practice.",
  
    "section_order": [
      "se-teamwork",
      "se-tools",
      "se-requirements",
      "se-design",
      "se-construction",
      "se-validation",
      "se-refactoring",
      "se-reliability",
      "sep-ethics-communication"
    ],
  
    "sections": [
      {
        "id": "se-teamwork",
        "ka_code": "SE",
        "title": "SE/Teamwork",
        "order": 1,
        "summary": "Collaboration, accountability, communication norms, and team processes.",
        "content_as_text": "Team roles, ceremonies, and communication patterns that enable effective collaboration.",
        "content_as_md": "",
        "topics": [
          { "id": "tw-collaboration", "name": "collaboration" },
          { "id": "tw-communication", "name": "communication" },
          { "id": "tw-accountability", "name": "accountability" },
          { "id": "tw-roles", "name": "roles" }
        ],
        "learning_outcomes": [
          {
            "id": "SE-LO-TW-001",
            "text": "Contribute effectively to a software team using agreed workflows and communication channels.",
            "cognitive_level": "Apply"
          }
        ],
        "bullets": [
          {
            "id": "b-tw-1",
            "text": "Define roles, responsibilities, and handoff expectations.",
            "subbullets": [
              {
                "id": "b-tw-1a",
                "text": "Run effective code reviews with constructive feedback.",
                "subbullets": []
              }
            ]
          }
        ],
        "crossrefs": [
          { "type": "KA", "target": "se-tools", "rel": "related", "notes": "Team norms depend on tooling choices." }
        ],
        "qa_flags": { "needs_review": false, "reasons": [], "notes": "" },
        "source_loc": {
          "pages": { "start": 185, "end": 188 },
          "anchors": [{ "id": "se-teamwork", "label": "Teamwork" }]
        },
        "subsections": []
      },
  
      {
        "id": "se-tools",
        "ka_code": "SE",
        "title": "SE/Tools and Environments",
        "order": 2,
        "summary": "Version control, IDEs, build, CI, static/dynamic analysis, dependency management.",
        "content_as_text": "Tools and environments supporting software development, including VCS, CI/CD, and analyzers.",
        "content_as_md": "",
        "topics": [
          { "id": "tools-vcs", "name": "version control" },
          { "id": "tools-ci", "name": "CI" },
          { "id": "tools-static", "name": "static analysis" },
          { "id": "tools-build", "name": "build systems" },
          { "id": "tools-deps", "name": "dependencies" }
        ],
        "learning_outcomes": [
          { "id": "SE-LO-TO-001", "text": "Use VCS branching strategies and CI to maintain code quality.", "cognitive_level": "Apply" }
        ],
        "bullets": [
          { "id": "b-to-1", "text": "Contrast static vs dynamic analysis and when to apply each.", "subbullets": [] }
        ],
        "crossrefs": [
          { "type": "KA", "target": "se-validation", "rel": "related", "notes": "CI integrates tests and quality gates." }
        ],
        "qa_flags": { "needs_review": false, "reasons": [], "notes": "" },
        "source_loc": {
          "pages": { "start": 188, "end": 191 },
          "anchors": [{ "id": "se-tools", "label": "Tools and Environments" }]
        },
        "subsections": []
      },
  
      {
        "id": "se-requirements",
        "ka_code": "SE",
        "title": "SE/Product Requirements",
        "order": 3,
        "summary": "Elicitation, specification, validation, change management.",
        "content_as_text": "Defining verifiable requirements; managing changes and stakeholder alignment.",
        "content_as_md": "",
        "topics": [
          { "id": "req-elicitation", "name": "elicitation" },
          { "id": "req-spec", "name": "specification" },
          { "id": "req-validation", "name": "validation" },
          { "id": "req-change", "name": "change management" }
        ],
        "learning_outcomes": [
          { "id": "SE-LO-REQ-001", "text": "Write verifiable, testable requirements and manage changes.", "cognitive_level": "Apply" }
        ],
        "bullets": [
          { "id": "b-req-1", "text": "Stakeholder analysis and conflict resolution.", "subbullets": [] }
        ],
        "crossrefs": [
          { "type": "KA", "target": "se-design", "rel": "prereq", "notes": "Design depends on clear requirements." }
        ],
        "qa_flags": { "needs_review": false, "reasons": [], "notes": "" },
        "source_loc": {
          "pages": { "start": 191, "end": 194 },
          "anchors": [{ "id": "se-requirements", "label": "Product Requirements" }]
        },
        "subsections": []
      },
  
      {
        "id": "se-design",
        "ka_code": "SE",
        "title": "SE/Software Design",
        "order": 4,
        "summary": "Architecture, design patterns, modularity, coupling/cohesion, rationale.",
        "content_as_text": "Architectural styles and component-level design emphasizing modularity and rationale capture.",
        "content_as_md": "",
        "topics": [
          { "id": "design-architecture", "name": "architecture" },
          { "id": "design-patterns", "name": "design patterns" },
          { "id": "design-modularity", "name": "modularity" },
          { "id": "design-cohesion", "name": "cohesion" }
        ],
        "learning_outcomes": [
          { "id": "SE-LO-DES-001", "text": "Create and document an architecture and component design with rationale.", "cognitive_level": "Create" }
        ],
        "bullets": [
          {
            "id": "b-des-1",
            "text": "Apply layered or microservices styles; justify tradeoffs.",
            "subbullets": [
              { "id": "b-des-1a", "text": "Document decisions with ADRs.", "subbullets": [] }
            ]
          }
        ],
        "crossrefs": [
          { "type": "KA", "target": "se-validation", "rel": "related", "notes": "Design-for-testability" },
          { "type": "CWE", "target": "CWE-209", "rel": "related", "notes": "Information exposure via design choices" }
        ],
        "qa_flags": { "needs_review": false, "reasons": [], "notes": "" },
        "source_loc": {
          "pages": { "start": 194, "end": 197 },
          "anchors": [{ "id": "se-design", "label": "Software Design" }]
        },
        "subsections": [
          {
            "id": "se-design-architecture-styles",
            "ka_code": "SE",
            "title": "Architecture Styles",
            "order": 4.1,
            "summary": "Layered, microservices, event-driven, hexagonal.",
            "content_as_text": "Survey of architectural styles with typical forces and tradeoffs.",
            "content_as_md": "",
            "topics": [
              { "id": "arch-layered", "name": "layered architecture" },
              { "id": "arch-msa", "name": "microservices" },
              { "id": "arch-eda", "name": "event-driven architecture" },
              { "id": "arch-hex", "name": "hexagonal architecture" }
            ],
            "learning_outcomes": [],
            "bullets": [],
            "crossrefs": [
              { "type": "KA", "target": "se-refactoring", "rel": "related", "notes": "Refactors between styles" }
            ],
            "qa_flags": { "needs_review": false, "reasons": [], "notes": "" },
            "source_loc": {
              "pages": { "start": 195, "end": 196 },
              "anchors": [{ "id": "arch-styles", "label": "Architecture Styles" }]
            },
            "subsections": []
          }
        ]
      },
  
      {
        "id": "se-construction",
        "ka_code": "SE",
        "title": "SE/Software Construction",
        "order": 5,
        "summary": "Implementation practices, coding standards, readability, defensive programming.",
        "content_as_text": "Coding conventions, defensive techniques, and maintainability practices.",
        "content_as_md": "",
        "topics": [
          { "id": "constr-impl", "name": "implementation" },
          { "id": "constr-readability", "name": "readability" },
          { "id": "constr-defensive", "name": "defensive programming" }
        ],
        "learning_outcomes": [
          { "id": "SE-LO-CON-001", "text": "Apply coding standards and defensive techniques to produce maintainable code.", "cognitive_level": "Apply" }
        ],
        "bullets": [],
        "crossrefs": [],
        "qa_flags": { "needs_review": false, "reasons": [], "notes": "" },
        "source_loc": {
          "pages": { "start": 197, "end": 198 },
          "anchors": [{ "id": "se-construction", "label": "Software Construction" }]
        },
        "subsections": []
      },
  
      {
        "id": "se-validation",
        "ka_code": "SE",
        "title": "SE/Verification and Validation",
        "order": 6,
        "summary": "Testing levels, strategies, coverage, CI testing, reviews, static/dynamic analysis.",
        "content_as_text": "Unit, integration, and system testing; CI integration; reviews and analysis.",
        "content_as_md": "",
        "topics": [
          { "id": "vv-unit", "name": "unit testing" },
          { "id": "vv-integration", "name": "integration testing" },
          { "id": "vv-coverage", "name": "coverage" },